{
  "$schema": "../schemas/chart.schema.json",
  "id": "md-pgcc-2020",
  "jurisdiction": "MD",
  "title": "Planul general de conturi contabile",
  "effectiveFrom": "2020-01-01",
  "effectiveTo": null,
  "publishedOn": "2026-10-05",
  "status": "draft",
  "notes": "Chapter II (the nomenclature) as restated by OMF 100/2019 and amended by OMF 171/2019, in force from 1 January 2020, transcribed from the Ministry of Finance's consolidated text. Each account's nature (activ or pasiv, and whether it is rectificativ, de calculație or de colectare – repartizare) is from its own sentence in chapter III where there is one, from the opening of classes 6 and 7 otherwise, and from chapter I's general rule for the three accounts that state none (172, 262, 344). OMF 111/2021 is read: it changed only correspondent accounts in the descriptions of 143, 254 and 316, nothing this file holds. OMF 135/2019 is read too: it amends only the methodological indications of OMF 188/2014, not the chart. Abrogated in 2019 and so absent: accounts 312 and 413, subaccount 7143. Names keep the act's spelling (î, \"sînt\"); the PDF's cedilla ş and ţ are written as ș and ț.",
  "sources": [
    {
      "act": "Ordinul Ministrului Finanțelor nr. 119 din 06.08.2013 privind aprobarea Planului general de conturi contabile",
      "article": "cap. I-III, as consolidated by the Ministry of Finance (PDF, Last-Modified 2020-05-28, SHA-256 0b2271eb4477f8fa4af660a227669629c9162651c99d1f144feb9b6eb64764ab)",
      "publication": "Monitorul Oficial nr. 233-237, art. 1534, 22.10.2013",
      "url": "https://mf.gov.md/sites/default/files/legislatie/Planul%20general%20de%20conturi%20contabile.pdf",
      "verified": false
    },
    {
      "act": "Ordinul Ministrului Finanțelor nr. 100 din 28.06.2019 cu privire la aprobarea modificărilor la Ordinul nr. 119/2013",
      "publication": "Monitorul Oficial nr. 230-237, art. 1275",
      "url": "https://www.legis.md/cautare/getResults?lang=ro&doc_id=115293",
      "verified": false
    },
    {
      "act": "Ordinul Ministrului Finanțelor nr. 171 din 19.12.2019 cu privire la aprobarea modificărilor la ordinele nr. 48/2019 și 100/2019",
      "publication": "Monitorul Oficial nr. 388-392, art. 2125, 27.12.2019",
      "url": "https://monitorul.gov.md/ro/monitor/2170",
      "verified": false
    }
  ],
  "closing": {
    "notes": "The closing entries at the end of the reporting period (perioada de gestiune), as chapters I and III state them: income (class 6) and expenses (class 7) settled into 351, whose balance is the period's net result and goes to 333, so 351 ends the period with no balance. Class 8's management accounts close into balance-sheet or result accounts by the entity's own calculation, before this. A non-commercial organisation uses 336 where a company uses 333 (chapter III, account 336); not encoded here. Page numbers are the physical pages of the Ministry of Finance's consolidated PDF named in sources[0].",
    "incomeClasses": [
      "6"
    ],
    "expenseClasses": [
      "7"
    ],
    "managementClasses": [
      "8"
    ],
    "resultAccount": "351",
    "netResultAccount": "333",
    "movements": [
      {
        "kind": "income",
        "debit": "6",
        "credit": "351",
        "source": {
          "sourceIndex": 0,
          "article": "cap. III, clasa 6 „Venituri”",
          "page": 50,
          "quote": "Conturile din clasa 6 “Venituri” sînt conturi de pasiv. În creditul acestor conturi pe parcursul perioadei de gestiune se înregistrează cu total cumulativ de la începutul perioadei veniturile recunoscute în conformitate cu standardele de contabilitate, iar în debit – decontarea la finele perioadei de gestiune a veniturilor acumulate la rezultatul financiar total."
        }
      },
      {
        "kind": "expenses",
        "debit": "351",
        "credit": "7",
        "source": {
          "sourceIndex": 0,
          "article": "cap. III, clasa 7 „Cheltuieli”",
          "page": 53,
          "quote": "Conturile din clasa 7 “Cheltuieli” sînt conturi de activ. În debitul acestor conturi pe parcursul perioadei de gestiune se înregistrează cu total cumulativ de la începutul perioadei cheltuielile recunoscute în conformitate cu standardele de contabilitate, iar în credit – decontarea la finele perioadei de gestiune a cheltuielilor acumulate la rezultatul financiar total."
        }
      },
      {
        "kind": "profit",
        "debit": "351",
        "credit": "333",
        "source": {
          "sourceIndex": 0,
          "article": "cap. III, contul 351 „Rezultat financiar total”",
          "page": 41,
          "quote": "În debitul contului 351 “Rezultat financiar total” se înregistrează decontarea cheltuielilor suportate și profitului net al perioadei de gestiune în corespondență cu creditul conturilor: 333, 711, 712, 713, 714, 721, 722, 723, 731 etc."
        }
      },
      {
        "kind": "loss",
        "debit": "333",
        "credit": "351",
        "source": {
          "sourceIndex": 0,
          "article": "cap. III, contul 351 „Rezultat financiar total”",
          "page": 41,
          "quote": "În creditul acestui cont se înregistrează decontarea veniturilor acumulate și pierderii nete a perioadei de gestiune în corespondență cu debitul conturilor: 333, 611, 612, 621, 622, 623 etc."
        }
      }
    ],
    "resultHasNoBalance": {
      "sourceIndex": 0,
      "article": "cap. III, contul 351",
      "page": 41,
      "quote": "Contul 351 “Rezultat financiar total” la sfîrșitul perioadei de gestiune nu are sold."
    },
    "managementAccountsFirst": {
      "sourceIndex": 0,
      "article": "cap. I; cap. III, clasa 8 „Conturi de gestiune”",
      "page": 57,
      "quote": "La data raportării conturile de gestiune se închid cu conturile de bilanț și/sau de rezultate."
    }
  },
  "classes": [
    {
      "code": "1",
      "name": "ACTIVE IMOBILIZATE",
      "section": "bilanț",
      "nature": "activ",
      "doubleEntry": true,
      "accountsMandatory": true,
      "entityMayAdd": [
        "subaccounts"
      ],
      "groups": [
        {
          "code": "11",
          "name": "IMOBILIZĂRI NECORPORALE",
          "accounts": [
            {
              "code": "111",
              "name": "Imobilizări necorporale în curs de execuție",
              "nature": "activ",
              "natureFrom": "account"
            },
            {
              "code": "112",
              "name": "Imobilizări necorporale în exploatare",
              "nature": "activ",
              "natureFrom": "account",
              "subaccounts": [
                {
                  "code": "1121",
                  "name": "Concesiuni, licențe și mărci"
                },
                {
                  "code": "1122",
                  "name": "Drepturi de autor și titluri de protecție"
                },
                {
                  "code": "1123",
                  "name": "Programe informatice"
                },
                {
                  "code": "1124",
                  "name": "Alte imobilizări necorporale"
                }
              ],
              "note": "Chapter III, not restated in 2019, still heads it \"Imobilizări necorporale\"; the nomenclature (chapter II, restated by OMF 100/2019) wins."
            },
            {
              "code": "113",
              "name": "Amortizarea imobilizărilor necorporale",
              "nature": "pasiv",
              "natureFrom": "account",
              "qualifier": "rectificativ",
              "subaccounts": [
                {
                  "code": "1131",
                  "name": "Amortizarea concesiunilor, licențelor și mărcilor"
                },
                {
                  "code": "1132",
                  "name": "Amortizarea drepturilor de autor și titlurilor de protecție"
                },
                {
                  "code": "1133",
                  "name": "Amortizarea programelor informatice"
                },
                {
                  "code": "1134",
                  "name": "Amortizarea altor imobilizări necorporale"
                }
              ]
            },
            {
              "code": "114",
              "name": "Deprecierea imobilizărilor necorporale",
              "nature": "pasiv",
              "natureFrom": "account",
              "qualifier": "rectificativ",
              "history": [
                "modificat prin Ordinul Ministerului Finanțelor nr.100 din 28.06.2019, în vigoare 01.01.2020"
              ]
            },
            {
              "code": "115",
              "name": "Fond comercial pozitiv",
              "nature": "activ",
              "natureFrom": "account",
              "history": [
                "introdus prin Ordinul Ministerului Finanțelor nr.100 din 28.06.2019, în vigoare 01.01.2020"
              ]
            },
            {
              "code": "116",
              "name": "Fond comercial negativ",
              "nature": "pasiv",
              "natureFrom": "account",
              "history": [
                "introdus prin Ordinul Ministerului Finanțelor nr.100 din 28.06.2019, în vigoare 01.01.2020"
              ]
            },
            {
              "code": "117",
              "name": "Deprecierea fondului comercial pozitiv",
              "nature": "pasiv",
              "natureFrom": "account",
              "qualifier": "rectificativ",
              "history": [
                "introdus prin Ordinul Ministerului Finanțelor nr.100 din 28.06.2019, în vigoare 01.01.2020"
              ]
            }
          ]
        },
        {
          "code": "12",
          "name": "IMOBILIZĂRI CORPORALE, TERENURI, MIJLOACE FIXE ȘI RESURSE MINERALE",
          "note": "Chapter III, not restated in 2019, still heads it \"IMOBILIZĂRI CORPORALE\"; the nomenclature wins.",
          "accounts": [
            {
              "code": "121",